{
  "schema_version": "rewireperform-feedback-intelligence-staging-postdeploy-assurance-v2",
  "contract_status": "PASS_POSTDEPLOY_ASSURANCE_UNSIGNED_AWAITING_CONSUMER_REVIEW",
  "target_project_ref": "zbeswjipayspgvcipzmx",
  "remote_migration": {
    "version": "20260809113253",
    "name": "feedback_intelligence_declined_consent_export_remediation",
    "local_path": "supabase/migrations/20260809093000_feedback_intelligence_declined_consent_export_remediation.sql",
    "local_sha256": "b82bdda5a60133e8ada310bfacdfbf50475f4a56d65668b41a3dcd96071ed2e6",
    "applied": true
  },
  "database_assurance": {
    "executed_at": "2026-08-09T11:33:20.00875+00:00",
    "audit_phase": "POSTDEPLOY_ASSURANCE",
    "validator_status": "PASS_POSTDEPLOY_ASSURANCE",
    "result_path": "docs/feedback-intelligence/contracts/staging-privilege-audit-v0.2/remote-staging-postdeploy-result-2026-08-09.json",
    "result_sha256": "087ed49f622cc6eca77177c31229601c1dafb72ba005365c2c14098518f48fb0",
    "audit_sql_sha256": "7f7865f769f46bfab204c37d071ee743636fe183f6d6876a24557e51dc508bd3",
    "audit_package_manifest_sha256": "8b2a98c143780056046a2d98d83b25786e58c31f800ffb726d20ff12528690b5",
    "audit_package_sha256": "06e86e836f8100a3e377a26d137881831aeaa456ecf1a8eaf13530a11863e4cf",
    "application_rows_read": false,
    "application_functions_called": false,
    "database_mutated": false,
    "function_definition_sha256": {
      "gateway": "0d617fcb5e5a7ece31ca94b7ff0cf07026712b0d9ed4206c95bee9f4b198a8af",
      "internal_export": "89420ddf3f79ad57538f4fb1ad56458717874490ddbc88b52d577e081d3e872f"
    }
  },
  "edge_assurance": {
    "slug": "mahleos-feedback-intelligence-read",
    "deployment_id": "4579d2b9-16c9-4387-be84-d5a5b440265e",
    "observed_version": 11,
    "status": "ACTIVE",
    "verify_jwt": false,
    "ezbr_sha256": "952c86471d41377314d53c1663716717957519132233ddd7abf6aee68c7be8ee",
    "source_file_count": 6,
    "source_manifest_sha256": "97d6714a8871f510996cfd39fc23505fde0f5b82a02e1acfd4627f201eecbf91",
    "deployed_source_byte_match": true,
    "redeployed_in_this_gate": false
  },
  "approved_inputs": {
    "producer_deployment_source_commit": "1e34e4559d6f5df5aab162f84786f8262ddedea8",
    "producer_implementation_commit": "970f581fb855ecff432283f099de6b85a95fc564",
    "gateway_manifest_sha256": "97b4caf3109650be74963587c1340ddd699e0aa80b6acf587da79cfdf0ed001d",
    "gateway_package_sha256": "15c85f345592c7df3b0c700134ff5ab2c6b7b86b3ea64e4a7088168a488dbbbb",
    "release_pair_sha256": "21028aba62cc882b6a57c65e7a039b64f980d15393c4d7757ece43fd7574b585",
    "consumer_acceptance_commit": "abfc59fe92d33b5f5ef8a36626ba89c92a5d4de0",
    "consumer_acceptance_sha256": "52faaedc994af43b2c0f0c99cb11680072e2581dedcfddf04fcfc2bbd4d71b51"
  },
  "external_gates": {
    "consumer_postdeploy_review_required": true,
    "credentials_provisioned": false,
    "reader_password_provisioned": false,
    "network_read_performed": false,
    "production_approved": false,
    "real_data_read": false,
    "push_performed": false,
    "merge_performed": false
  }
}
